Issue-link,Issue-Title,Type of Libraries
https://github.com/micrometer-metrics/micrometer,/micrometer-metrics/micrometer/issues/1713,Counters not idempotent / state & lifecycle unclear,Monitoring
https://github.com/micrometer-metrics/micrometer,/micrometer-metrics/micrometer/issues/1678,Initialize `jvm.gc.max.data.size` to correct value before any GC events,Monitoring
https://github.com/micrometer-metrics/micrometer,/micrometer-metrics/micrometer/issues/1396,Log cloudwatch metric data when unable to send to cloudwatch,Monitoring
https://github.com/micrometer-metrics/micrometer,/micrometer-metrics/micrometer/issues/1274,Improve system metrics with oshi,Monitoring
https://github.com/micrometer-metrics/micrometer,/micrometer-metrics/micrometer/issues/549,Add disk space binder,Monitoring
https://github.com/greenmail-mail-test/greenmail,/greenmail-mail-test/greenmail/issues/284,Update embedded default certificate,Mail
https://github.com/greenmail-mail-test/greenmail,/greenmail-mail-test/greenmail/issues/260,greenmail.auth.disabled doesn't work as expected,Mail
https://github.com/greenmail-mail-test/greenmail,/greenmail-mail-test/greenmail/issues/215,Sonar link in README is invalid,Mail
https://github.com/easymock/easymock,/easymock/easymock/issues/185,Support for @TestSubject to do constructor injection,Mocks
https://github.com/mockito/mockito,/mockito/mockito/issues/1838,Improve the error message on contains method,Mocks
https://github.com/mockito/mockito,/mockito/mockito/issues/1651,Shipping Mockito Javadocs,Mocks
https://github.com/mockito/mockito,/mockito/mockito/issues/1249,Investigation public API Mockito,Mocks
https://github.com/mockito/mockito,/mockito/mockito/issues/1225,Ensure auto-replacement of deprecated methods in IntelliJ,Mocks
https://github.com/mockito/mockito,/mockito/mockito/issues/1571,Misleading error message in the reporter regarding misuse of additional matchers,Mocks
https://github.com/mockito/mockito,/mockito/mockito/issues/958,Document migration path of 'any()' matcher in Javadocs,Mocks
https://github.com/mockito/mockito,/mockito/mockito/issues/930,Update contributing guidelines,Mocks
https://github.com/mockito/mockito,/mockito/mockito/issues/940,Defender (default) methods are under documented,Mocks
https://github.com/mockito/mockito,/mockito/mockito/issues/1359,Update Gradle files to Kotlin,Mocks
https://github.com/mockito/mockito,/mockito/mockito/issues/1291,"Example for matcher-based mocking should show, not merely state, that non-matched arguments must use matchers.",Mocks
https://github.com/mockito/mockito,/mockito/mockito/issues/713,Link to Brice voxxed article from documentation,Mocks
https://github.com/mockito/mockito,/mockito/mockito/issues/545,Ensure thread safety of mockito is documented in Javadoc,Mocks
https://github.com/mockito/mockito,/mockito/mockito/issues/531,Promote MockitoRule as preferred way to initialize annotated fields in the docs,Mocks
https://github.com/mockito/mockito,/mockito/mockito/issues/320,Mockito keeps references to disposed class loaders in the ,Mocks
https://github.com/mockito/mockito,/mockito/mockito/issues/725,Mockito should report mismatched argument warnings when using mocks in unconfigured ways,Mocks
https://github.com/mockito/mockito,/mockito/mockito/issues/687,"Add mockito, bytebuddy, objenesis version to Platform (maybe git commit to)",Mocks
https://github.com/powermock/powermock,/powermock/powermock/issues/1019,Documentation not correct for running powermock with mockito1,Mocks
https://github.com/powermock/powermock,/powermock/powermock/issues/989,PowerMock wiki global ignore incorrect example,Mocks
https://github.com/powermock/powermock,/powermock/powermock/issues/986,"""MockStatic"" wiki article incorrect link",Mocks
https://github.com/powermock/powermock,/powermock/powermock/issues/776,"Android, PowerMock: javassist.NotFoundException:",Mocks
https://github.com/powermock/powermock,/powermock/powermock/issues/779,IllegalStateException: Failed to transform class with name backend.model.posting.PostingTest. Reason: before ()V in backend.model.posting.PostingTest: inconsistent stack height -1,Mocks
https://github.com/powermock/powermock,/powermock/powermock/issues/914,Incorrect documentation about PowerMockRule class usage,Mocks
https://github.com/powermock/powermock,/powermock/powermock/issues/927,Port Log4jMockPolicy to Mockito2,Mocks
https://github.com/powermock/powermock,/powermock/powermock/issues/660,"Custom runner delegate, ""Notifications are not supported when all test-instances are created first""",Mocks
https://github.com/powermock/powermock,/powermock/powermock/issues/396,ExpectedException.expectMessage AssertionError lost with PowerMockRunner,Mocks
https://github.com/powermock/powermock,/powermock/powermock/issues/116,Add support for mock aliases,Mocks
https://github.com/powermock/powermock,/powermock/powermock/issues/628,Add page about mocking enum to wiki,Mocks
https://github.com/powermock/powermock,/powermock/powermock/issues/482,JavaDoc of org.powermock.api.mockito.PowerMockito.verifyNew(Class<T>) is a little incomplete/unprecise,Mocks
https://github.com/powermock/powermock,/powermock/powermock/issues/135,Update description on the front page,Mocks
https://github.com/powermock/powermock,/powermock/powermock/issues/354,Update Wiki examples,Mocks
https://github.com/perwendel/spark,/perwendel/spark/issues/1142,Example on books on README.md (front page of github) has bugs,Mocks for HTTP
https://github.com/perwendel/spark,/perwendel/spark/issues/1021,Documentation lacks information/examples on setting Jetty request size,Mocks for HTTP
https://github.com/perwendel/spark,/perwendel/spark/issues/903,Add more information methods like port() to get server parameters,Mocks for HTTP
https://github.com/tomakehurst/wiremock,/tomakehurst/wiremock/issues/1138,"incomplete documentation for ""Pushing JSON files to a remote WireMock instance""",Mocks for HTTP
https://github.com/tomakehurst/wiremock,/tomakehurst/wiremock/issues/1078,API docs on custom helpers has a typo,Mocks for HTTP
https://github.com/tomakehurst/wiremock,/tomakehurst/wiremock/issues/1126,"DEBUG level logs for verbose mode, log request details before calling reponse renderer",Mocks for HTTP
https://github.com/tomakehurst/wiremock,/tomakehurst/wiremock/issues/1041,Docs don't specify how to configure proxying with catch-all stub from the cmd line,Mocks for HTTP
https://github.com/tomakehurst/wiremock,/tomakehurst/wiremock/issues/904,Docs for running standalone with extensions are circular,Mocks for HTTP
